ResponseIdHash,Q17_4,code1,code2,code3,code4
ebe7e2ced50f721ada0b8552cb92b674,It may be an emergency,new-code,,,
d0c7e0a42fa2d87efddb206419a96dd4,I'm not sure we really need to travel here anyway,no-harm,,,
9f9909863f1776fbbf302c680b717b0c,society would not advance slower technologically. ,delay-in-innovation,,,
e7d78d62726d0ffa042e06eeb5b90523,"without the assistance of Tech-X/Tech-X 10, educational content creation may struggle to adapt to the diverse learning styles and preferences of individual students. This could lead to a less engaging and less effective learning experience for a wide range of learners.",impede-personal-growth,hinder-creative-work,lose-accessibility-solution-servie,inefficiency
5e338c0647ee49bc22f8d062090490ba,it would make it harder to pay taces.,inefficiency,stress-overworked,financial-disturbance,
2a42751454906089da1c9bdc104ee8a4,There's really no real negative impact if this was banned or not developed. It was more of a convenience to have Tech-X draw the drawings.,no-harm,,,
564affc289d5b70ab233da089cba347f,It might slow down the learning of new knowledge.,delay-in-innovation,,,
0247931335c73a0b4bbbe16232fb2dc8,it failed to help.,no-harm,,,
653c94b6651f81771acd859bbedc7778,"Again, this would impact me more than anyone else, unless I had Tech-X communicate something important to another that was incorrect.",misinformation,lose-assistance,,
961edca230872c3041494709cb2828a4,It wouldn't be harmful. People would just go about making their meal and grocery decisions like they do now. There is no negative impact to not developing this technology other than the simple lack of progress.,no-harm,,,
968f2ca7ccf8f4032facf3bfc17eb0bd,because calculations will go wrong,human-error,,,
4b6400df694a607aecce753cb8ae98f7,I believe that there will be a very limited and privileged group of people who will develop AI secret who will use it for their own personal gain rather than the good of all humankind.,new-code,less-innovation,lose-transparency,economic-distrubance
535905614be4145ab72d108886e39014,"We allowed our fears, once again to keep us from change. ",less-innovation,,,
25e7d0b46bf512aaca3bef34379ffa63,you would have to monitor your home more closely.,lose-assistance,,,
780a10ee6a2804304f34d18ec72394bc,"the government would continue to be slow and inefficient, and become an increasing burden on taxpayers.",inefficiency,economic-distrubance,,
2ce49311b031cfd15806cf7527e32cc5,increases cost and reduce employment,economic-distrubance,business-loss,unemployment,
0030c892193501bc88d8401f8939bfc9,"AI can do tasks faster and cheaper. If AI is banned, then things will get expensive and slow.",economic-distrubance,waste-resources-or-time,,
ae7bd2ea37c78ccc8443713792f9622d,"The most important, aggressive healthcare interventions may not be applied and cause disease and death. ",physical-harm,hinder-medical-care,,
38360af12146a94e506b7bb5d01ef238,"It could stifle the potential for personal histories, and the potential for analyzing meta-histories.",less-innovation,lose-information-knowledge,,
bf5fe88dfc84a63864b371fec1fb5618,It would handle everything you wouldn't be as necessary as before.,impede-personal-growth,lose-assistance,,
d839fe37d4071d458923c7c8728128a3,It is now virtually impossible to figure out where jobs really need to be filled.,inefficiency,lose-information-knowledge,,
766754284886a780bbb15f690aeb61f8,Decrease in science research ,less-innovation,,,
846292910608f619a6bdbfe1146a15f9,It could slow down progress against climate change ,delay-in-innovation,environmental-harm-continues,,
674058f384141831d39485aa8065cab7,People would have limited access to information,lose-information-knowledge,,,
ff79ba1da1454746a92e9b2496f0f5fc,"the student would have to find other ways to study, making it nearly impossible to get that degree.",impede-personal-growth,inefficiency,stress-overworked,
c9e7827fbe7e042a1f05fa5c13856285,It will continue to happen ,na,,,
8f7d2fcc92635f2f4b718635e6cc86ed,"Based on the ideas I had for using the technology, people would not be harmed because they would continue to do these projects/tasks the same way they do today.  The new applications using the technology were really about improving the quality of our lives.",no-harm,,,
b4d65aceed0a76a38751abc6ad15d7a6,... humans may not be able to keep up and find timely solutions.,stress-overworked,waste-resources-or-time,,
0b4a08fa2ef9537fa294d82a12d074b5,I might interpret the complicated health insurance plans differently which would result in me incurring a big sum of medical expenses.,financial-disturbance,human-error,lose-transparency,
3f056792ae1110b2d15d925d0b189929,My health will suffer.,health-issues,,,
643eb5ce5ffd4628b7df95fb2a9a989b,it would be harmful because it could make the investment process slower and more prone to errors,human-error,waste-resources-or-time,,
e9600de19374e80684b238230ab21961,Visually/physically challenged people will miss out on being more independent in the day-to-day activities.,lose-accessibility-solution-servie,lose-assistance,,
a9f184c26c6727739a63a18fe6688c1f,"Then things will go on as is, and we don't have to worry about Tech X, and Tech X 10, getting in the wrong hands and killing people. We will just continue to allow the lack, to keep killing people.",no-harm,physical-harm,,
5e6fcb4004f2703be9d4f5b9c03dae57,I think this type of tech is inevitable and banning would only slow down development,delay-in-innovation,,,
e5b58d055cf7e85a1556295276f8c7dc,if the technology to invent it exists it would be a waste not to try it.,less-innovation,waste-resources-or-time,,
a7fc499ed69ded16e23e00c2a36f9a9c,A huge stress ,stress-overworked,,,
60d44adef99af5be796b2dd24bd33f26,humans who rely on technology would now lack the intuitive skills to work without it,impede-personal-growth,lose-assistance,,
a64ddcf323c53bfc242426f09458455f,the cancer will still be around and the cause of death is still exist,physical-harm,hinder-medical-care,,
32402c6238774f7c806e3cb21c0e573d,I waste so much time on these types of activities. Time that could be spent on productive things. Ot would make my mental health less good because i find these tasks tedious and boring. Ai could tell me when my phone bill was raised 10 and even call them and argue for me ,stress-overworked,lose-assistance,waste-resources-or-time,mental-harm
ad3019edd73f89e90c5ad6abeb498d98,without the tech app we are still in existence so i believe we can survive,no-harm,,,
20201c2b66ffd464d8b6adbdfc3836f4,I would continue to be in pain.,physical-harm,health-issues,mental-harm,
91e80106d7eef35614d2487cd3b7e050,I do not think it will be harmful,no-harm,,,
639b208cd22831cafac610ae39c25011,"it might cause many people to suffer, die, or become sicker because they did not have an easy way to access some medical information.",lose-accessibility-solution-servie,physical-harm,hinder-medical-care,health-issues
0a4c7e28657b6bd5fd5ba055938b5c69,Just takes too much time to do it well organically. Time savings could be used for anything else that is would also create more sales ,business-loss,waste-resources-or-time,,
e79299a8b60775bbab62b06615651ed6,I don't think it would make a lot of difference as advances in medicine happen anyway,no-harm,,,
72d216b8c94c89767a52f72ef140705f,Individuals will struggle to live objects arounds the house. this will cause spinal problems,physical-harm,health-issues,,
900a8f0272e58439d2a91aaddc15a18a,errors or mistakes might occur when manually assessing individual performances making the process less effective   ,inefficiency,human-error,,
c2330b9ddea7a69804f109cde289dab8,Those that hate bathing will not bath consistently,new-code,,,
afce71b3334590a354ae67b677d6fdd2,Banning would produce work-around solutions that would be incomplete approaches to solving complex problems,lose-accessibility-solution-servie,inefficiency,,
ce49ac6376affcbdd899736814030a51,Businesses would have to keep spending money of employees.,business-loss,waste-resources-or-time,,
8859bc3ba5e0989f9c947f2575b9ce70,We would run the risk of not being fully prepared in case disaster was headed our way.,lose-accessibility-solution-servie,inefficiency,lose-information-knowledge,
9ff9b390943cc8629f962d25e2256f01,it would continue to kill innocent people.,physical-harm,,,
ffdd3b62fdaa6c976ada1f608d7a7e67,People would not be able to get their questions as quickly anymore.,waste-resources-or-time,,,
5016b067c4ed4b5fb06d464726420292,the poor will languish in poverty.,impede-personal-growth,financial-disturbance,,
01a0e4073dac4963ada149d17b8945bc,It will be harmful because someone has to control it,na,,,
6a6c9271a5ab78b1b613ff8ee38f7635,Cliimate change would outpace our ability to stymie it. We might cross a threshold where there is no road back.,environmental-harm-continues,,,
7125390f48fc38d228e6ad642bd87a1e,It would be costly for working class people.,financial-disturbance,,,
27ad98eaae88201d61c8c286ddfd725d,it would endanger us ,new-code,,,
b71cd0421551664a42a80a5356202ddb,I don't think that there would be catastrophic harms due to the fact we could carry on as is.,no-harm,,,
407bcbd9bd05e6d015032a835c040ffa,It will be harmful because the level of fraud will be much committed without no regulation or checks. ,misinformation,human-error,,
33456d2a9205b6dfc3fe724b9a7d306c,the worldwide problem of hunger would not be adequately solved or addressed. Without Tech-X 10's contribution there may not be other ways the human members would have thought about to try to solve the hunger issue.,lose-accessibility-solution-servie,less-innovation,,
900abd7e39b2c8074200a115feee2c6d,many people would be left out of the opportunity to learn new skills.,impede-personal-growth,,,
0fb7330bff3b1ac250258fee41d509b2,,na,,,
a6cf5894b9be0560ac2034be738d6b41,"Limits society in a way that could offer growth. By teaching people to be self sufficient, it empowers them and builds confidence. It has all kinds possible positive influences that could be lost. Not to mention encourage laziness and waste.",impede-personal-growth,waste-resources-or-time,mental-harm,
ae7ed37619ea165e965af00092eecd0e,"no, it would not negatively impact individuals",no-harm,,,
83fbbf07b684690de7c8ffb052fc00b5,It would be harmful because people will be stressed and depressed with plenty duties to attend to,stress-overworked,mental-harm,,
f69241295af2781a908ddf65314c8595,A bit of deep disappointment and dashed hope of seeing or being in the presence and being able to interact with technology such as this would definitely offer hope and an outlet to many.,impede-personal-growth,mental-harm,,
0c483d36388a4d439288093086a4ad2b,It will take a lot of manpower and time to go through all the available reports to try to come up with a solution that will work.,stress-overworked,waste-resources-or-time,,
5fb5a851b864edcb49609c559aebb9ba,I would have to continue doing my job the way I have been doing it for 9 years. I will continue to be stressed out from time to time due to pressure to have certain reports done quickly. ,inefficiency,stress-overworked,,
81c3d7d48c65f49f3aae73635699b162,"the ""enemy"" will exploit and take advantage of entities that ban or not develop AI technologies.",economic-distrubance,lose-tech-race,,
2263934e8b1f4de1536e799f5048df8a,Its really wouldn't be harmful at all it would just not be as convenient.,inefficiency,,,
f3ae9e3adb2fcbb94a7a36aeb108c4b3,"It would negatively impact individuals, in that they now have to go through the stress of doing their strenous tasks all by themselves in hours of tiring themselves whereas it would have been close to effortless deal had the application being developed",inefficiency,stress-overworked,lose-assistance,
0ec32f1c0fdf6a48f22b37519393d06c,Many normal people would not have the opportunity to improve and extend their lives.,impede-personal-growth,lose-assistance,,
6c3859497408f69338c4bf67bf36186d,I don’t think it would be harmful really.  We’ve all made due and been successful without this type of technology.  People who are talented would still be able to make money and be successful without tech x,no-harm,,,
5416f5a3d7082b96f7a45731948533c7,"If there was such an application and it wasn't used to advance technology, it could be harmful in that we might not be as advanced technology wise as another country using this technology.  ",less-innovation,lose-tech-race,,
c7dfa1be579739405574dd6b8add72e1,"government and public agencies will continue to operate in a wasteful and ineffective manner, failing to provide the services they receive funding for",inefficiency,lose-transparency,waste-resources-or-time,
7a8c6bfa133a5a484bc1b1126476eada,we still need the technology developed to help  needed people,lose-assistance,,,
02d7ea41cb0686b59dfd0f0086953c0f,"[not inherently harmful, but] it would cause the advance in medical treatments to slow down or stagnate, making it harder to find and provide new and more effective treatments to some conditions.",delay-in-innovation,less-innovation,hinder-medical-care,
3b07b153bd77735e9660df550a4e3536,"Without the assistance of Tech-X 10, the development process for innovative medical technologies could be significantly slower. This delay may postpone breakthroughs, leading to prolonged suffering for patients awaiting advanced treatments and cures.",delay-in-innovation,less-innovation,hinder-medical-care,
b71ae93d27511d8a973d6703a4047da3,some people may not be able to readily access help,lose-accessibility-solution-servie,,,
f7e6fff0e588ea3ccf52708e26c2e761,Well there's enough killing going on in the name of religion I don't think there's any less harm going anyways,no-harm,,,
eebddd1037812efb5339581aabdf5446,Parents will not have access to adequate child care.,lose-accessibility-solution-servie,,,
166f542a9b71fb9b076bd36309607beb,people will continue to suffer or die but at the regular rate. ,no-harm,,,
69583295322542a47ef057731748be67,Nothing would change ,no-harm,,,
fac37c4217f4f4b503d9aa9642ccff23,"If personalized healthcare was not automated or assisted by Tech-X/Tech-X 10, it would be harmful because it would hinder the potential for accurate diagnoses, tailored treatment plans, and timely interventions, limiting the ability to optimize healthcare outcomes and potentially depriving individuals of the benefits of advanced technology in healthcare.",inefficiency,lose-assistance,hinder-medical-care,health-issues
0e5e232bdc2bd0f9675ce47de777cd04,It will slow me down in producing good plans .  It might be too stressed if I try to produce  a high value drawings. The clients will be limited to know only the designs I can produce  ,hinder-creative-work,lose-accessibility-solution-servie,stress-overworked,
fe233e2441a6759f22243210fcf7a49e,New technology would not be used to help man kind.,less-innovation,,,
8fe5fdc5266fa67d445c0a3279c5087a,humans are biased and limited and often unable to combine various fields of thought.,impede-personal-growth,human-error,,
ead77c31f4416eff0ec73cc08ef81174,"I think it would have a minimal impact because people can gather information themselves, just takes longer.",delay-in-innovation,inefficiency,,
4747f9cebc660a102f1a3dc6b440990f,Tax payer funds will continue to be funnelled to foreign countried,economic-distrubance,,,
bdf64e748de69e98ddadf4b6c4e81e6b,Increase the risk of accidents at the workplace and jeopardize the safety protocols of the firm,human-error,physical-harm,,
406eb3f0b9284ea66e4c4592abc9a42b,People might miss out on the benefits ,new-code,impede-personal-growth,lose-assistance,
7d5d5622459a7eb36a13cd0f170b50c5,any banning of new technologies is harmful to humanity. ,new-code,delay-in-innovation,less-innovation,
0b50b885d43e1fe54a3be3c5c3858481,the misunderstandings between different groups that speak different languages will still exist. ,hinder-communication,,,
87b666f0d46fac7dba96d8f3afb2e320,it would just take longer for some research to be performed,delay-in-innovation,,,
637afe5f72698b3d974c67d2a4491bb7,it would deprive people of an opportunity to address their loneliness,mental-harm,,,
a3d4ba394e62883ccb20397ade3a8ccb,Of security reasons and gaining information.,na,,,
c31337f17a3a6080918135cbf7444054,More time would be spent of these tasks and more money would be spent to hire someone to do the tasks,financial-disturbance,waste-resources-or-time,,
50510a2e37fcb1e917b80eac7078be55,"It would just continue the world as it it now. People who this would sssist would never benefit from this, they would never be able to have an easy accessible translator or visual akd",lose-accessibility-solution-servie,lose-assistance,,
8f899bfaf20aa9eb784e93c1646b1b7d,It would not be that bad it is a simple task,no-harm,,,
c8afd56386b0f06ac3d2650749e3e80c,It would limit the benefits having clean water in nations that need it.,lose-accessibility-solution-servie,health-issues,,
7e478da78dc172b96acbb916ab4d7407,"Honestly, it wouldn’t be too bad, it works just cost me more time",waste-resources-or-time,,,
1112b3671c909db2bf3a13c2f9d0d4ea,i don't think it would be harmful,no-harm,,,
973f53306ffb33946957ecc557ca1e7d,People would lose accessible information and education,lose-accessibility-solution-servie,lose-information-knowledge,,
5c890ed3111aa0b62f6e6c9886ee4a5a,I guess if it would work it would make a big difference,na,,,
8332fc1196e0fa130df57140d8945e14,people would not be able to reach their potentials.,impede-personal-growth,,,
a96868bf40fbb328c199f88102b90fe5,It might stunt research speed.,delay-in-innovation,,,
da3d78bb54599a46da57b93d42eea012,it would not help save more lives in the future.,hinder-medical-care,,,
3214488d946459ec435b6d24f791647f,Some people might have issues accessing health care,hinder-medical-care,,,
42254b30a082cd372051e7ead6598bac,"The current status quo would continue, where people's lives are being wasted on unfulfilling labor for low pay.",stress-overworked,financial-disturbance,waste-resources-or-time,
eebffb6f55c3edec57bf08740f002d9d,"We are losing out on a valuable tool to aid in decision making, potentially on a large scale ",lose-assistance,economic-distrubance,,
8f2ff716bc9469b537a985047f22a5a4,It would be more harmful to create such technology ,no-harm,,,
ab0deb4cac674c320ea222c56ee76a31,"People might make decisions without considering an unbiased, knowledgeable different point of view. ",misinformation,human-error,,
9d3eee819752592b3c522e2006560879,It might negatively impact individuals whose lives might be saved by artificial intelligence by keeping them in a permanently handicapped state with little hope of improvement. ,physical-harm,hinder-medical-care,,
947685b3e2baa963b643a10235078a60,people would miss out on finding the best valued plays,lose-accessibility-solution-servie,,,
a9aeb50b73aa95082fe1bde33c6c765c,"""...it would take much longer for healthcare professionals to analyze medical images and develop treatment plans, which could lead to delays in care and worse health outcomes for patients. Additionally, without the assistance of Tech-X 10, it would be more difficult for healthcare organizations to collect and analyze large amounts of data, which could lead to missed opportunities for improving care and reducing costs. Finally, without the personalized care and support that Tech-X 10 could provide, patients may feel like they are just a number and not an individual.""",delay-in-innovation,lose-assistance,hinder-medical-care,health-issues
233ce5568aaf2762b8538659eb60a300,Many individuals will continue suffering from ailments that could potentially worsen in time.,hinder-medical-care,health-issues,,
e4dd7b055afabc79a41cd66017859bde,"at this day and age, we should also start taking steps into bettering our health at no extra crazy cost ",na,,,
b9f8bd55cefcd56c366a1ae177bd6875,it would hinder the advancement of technology and widespread information,less-innovation,lose-information-knowledge,,
375414e96d6516b84488e32cbe997891,it could hinder some people's ability to create.,hinder-creative-work,,,
a6ff26e7202cf1827cd5171b42d9d2da,"people would lack affordable, time-friendly access to new knowledge/skills",impede-personal-growth,lose-accessibility-solution-servie,,
6be3a88c2edcbbdd99f432e15ccd3124,cause said immigrants would not recieve translation support easily,lose-assistance,hinder-communication,,
0b87da620e35d054fd39c8a7fad732d1,"It wouldn't be able to provide people with a productive schedule, or motivate them to improve their creative growth.",impede-personal-growth,lose-assistance,,
b902cbdee70eec027d40423fa0dcb788,"Potential advances, cures, and solutions in medical science could be lost.",delay-in-innovation,less-innovation,hinder-medical-care,
4a0157be005bcb31b0fc8cedc24a16f4,People that don't know how to code or don't have the money won't be able to build an app,impede-personal-growth,financial-disturbance,,
8fb20e00caf057115dd35b9934edf69e,people would miss out on the opportunity of learning and studying a new language quickly and with ease,impede-personal-growth,lose-accessibility-solution-servie,,
ff45b3f92e2029ca771377f77d592cb4,It would cause the work to be much slower for the employee as they'd have to review their own documentation ,stress-overworked,waste-resources-or-time,,
e78cf8dd2d08f515d5590895836897cf,it would not be helping to assist in a problem that is cause simply by it existing.,no-harm,,,
582a2f35eb7a15fb6791b698f9e56b6f,I don't think it would be harmful but it would deter many people from getting the help they need.,no-harm,lose-assistance,,
1145f907257825861d2df56393d9c198,It would restrict an opportunity,impede-personal-growth,,,
9702c0ce856eb00452675e66e02b14ea,It wouldn’t give people a chance to dream. ,impede-personal-growth,,,
68ae9acdd93d6b3d1ee0a758cdde777b,it wouldn't ,no-harm,,,
16ffaf4d08583a8f721354053829be3b,people would be fustrated not knowing what to cook.,stress-overworked,lose-assistance,,
4030f029688b03887fbd861f987e20fe,"people will get by without it, but I think that a lot of people wouldn't get the info that they bneeded if this was banned  because they dont have the time to research themselves.",stress-overworked,lose-information-knowledge,,
a9877a54ee851ddad002fb8ffa4b8720,none,no-harm,,,
d7876299450b29861270955dd39dfad1,people would waste food as they can't think of what to do with it,waste-resources-or-time,,,
27a2f65411018851eee51a9fa4f830ce,It could not guarantee the correct information is being shared,misinformation,,,
99effb05434204779a0a08a36774ef27,those who are infected or sick could be missing out on a potentially life saving cure,hinder-medical-care,,,
39d4042f86a82d1c25d97af923aa3a75,It will delay the speed at which we can produce treatments and medications. Healthcare costs will continue to skyrocket.,delay-in-innovation,economic-distrubance,hinder-medical-care,
dedfa49491164e0ec00c39d5a3a3dbb1,"humans would not be able to solve climate change without the technology, leading to catastrophic events.",physical-harm,environmental-harm-continues,,
d0a8a464d8fcff21525c004c901aea01,people would not be able to manage their time well and have less time in the day,stress-overworked,waste-resources-or-time,,
07d5f4e4c67d4196b9b70a48756e4a44,A person needing assistance with meal preparation may suffer without the aid.,impede-personal-growth,lose-assistance,health-issues,
274ccf2d376e944c272e6b6ee493c63d,The people were dependent on it would have to find a different means of getting the information they were getting from Tech-X / Tech-X 10 ,lose-accessibility-solution-servie,inefficiency,,
20e70671b62d6df142adc795592b0514,the current methods of monitoring health data is manual and time consuming which could lead to more human error.,human-error,waste-resources-or-time,,
b434b39bc72cf71dc413405f111fefc9,people will not find the information to help them.,lose-information-knowledge,,,
fc0058c0a20ef161a56ae92727889f57,It would force writers to use their own ideas to churn out stories,hinder-creative-work,,,
9b6efb4f21fbc248423d5a272150b7d9,Dating apps are quickly being saturated with people looking to make money and apps are struggling to keep people engaged. ,impede-personal-growth,business-loss,mental-harm,
12ae19854da7ef4137be69d5f60aefa9,"If the app is not developed, the company could lose the revenue it migjt have bring",business-loss,,,
71ba12f93cba89fe69a6543e0531aa58,We need to create better technology to reasonably deal with our dwindling resources,new-code,,,
61fafcd3905a2e12e50519ed7785b7fe,not much if it never gets develop we won't know what we are missing out on.,no-harm,,,
c52feb7e99f977833be9e4d01eb0a05d,The accident rate would probably stay similar to what it is now instead of declining as I assume it would if it was automated,no-harm,,,
5d89281741d8f47df529309ef2c2b7b1,it could've saved a lot of lives ,physical-harm,,,
7e9e81588a805b5050061fa782421c86,i will need to spend a lot of time generating surveys and causing me to lose time for other important business,stress-overworked,waste-resources-or-time,,
6eece659c409b7201c57dfc4f48b0f82,it will make us not to get the results we deserves.,impede-personal-growth,inefficiency,lose-information-knowledge,
e48ceccd549b9ead028d1c63fb803199,It would make us have to spend a lot of time on boring tasks. ,stress-overworked,waste-resources-or-time,,
dcdccfbdd109d08a6ef6cfd5bfabf80d,certain processes might take longer or be less cohesive due to differing information,inefficiency,hinder-communication,,
00184a91a3df3c0a876619b9c6b3cb62,"It would stifle scientific discovery, and in turn not assist society in evolving.",delay-in-innovation,less-innovation,,
7c04925ea26cee23c8b9f324fb63a306,It would be a hinderance,new-code,,,
da0d3d9dba07a9e2210b239222d01a16,"Pulling sources could take more time, leading to slower turnaround for studies. It could also lessen the scope of sources a researcher can consult.",delay-in-innovation,less-innovation,waste-resources-or-time,
