f9df7953ba3b6e10ff51f6f7c50aab94,then I would still be wasting time grading. I don't make much of an impact on how much a student learns  by grading their papers compared to actually explaining things. ,impede-personal-growth,stress-overworked,waste-resources-or-time,
fe6afd166efc31adb84800071e7b93d6,"of the current state of social and mainstream media, which are saturated by false and hateful rhetoric.",misinformation,,,
ca9d24745a6bca091ac9ef2b14e0375e,it feels as if it'd be a waste of potential.,less-innovation,,,
619fe9160723aa29c0967cff62e96c51,I do not think it would harm,no-harm,,,
57cebc93967710e9bbf5a6cd90668037,There honestly would be no harm in my opinion.,no-harm,,,
1ae1a3fcbb398c41ed1bb34ae8d14c7c,predictions made by any AI may not be based on powerful processing to give accurate answers.,misinformation,human-error,,
8dfa5ce2ebca1f5d287311dde04dce1b,I don't think it would. I think search engines such as Google right now do a good enough job. I jus think it's possible to do better.,no-harm,,,
c3aa3e6ebc61bd40fe96742c3d763966,None,no-harm,,,
3123a940c679b87f473c6a5b3aa5ea48,Human error,human-error,,,
9e93816ec47d887b11ea9e90e2761754,we would have less assistance with difficult tasks ,lose-assistance,,,
a0d012d92d88248367f0834e1ee2b099,"less people would have access to learning new languages and the accompanying learnings (i.e., learning about a new ulture)",impede-personal-growth,lose-accessibility-solution-servie,,
919e5b2ceb92f3fbfac725def37db6cc,It could make it so that they never receive a treatment that would have otherwise helped them.,hinder-medical-care,,,
d20153b789ae8541bd419e2e17f98838,IT will be a huge crisis if it's not being developed or it being banned. It will kill a lot of people. ,economic-distrubance,physical-harm,,
ae14a65adf2bfb2916c3cda887c2b496,You would still be subject to incorrect diagnoses by human doctors. ,human-error,hinder-medical-care,,
377bbc11d455dad4f60fba5753f625fc,I do not think that not developing the application will be all that harmful to anyone. ,no-harm,,,
62ef04859199dac911ec883dfc15eca9,people would have to spend a day each week to buy groceries,stress-overworked,waste-resources-or-time,,
8e04378591141b2e35ef032cd314657f,It will make communicating with different cultures more difficult,hinder-communication,,,
7abebab1ea76aa1d7464ae24ecbe929b,People who can't afford tutelage or lack artistic friends would struggle to improve.,impede-personal-growth,,,
469b021d198c1a1caf576e8dd3c2df03,it would make businesses spend more time on thinking about how to rule out their competition which would cost more money.,economic-distrubance,business-loss,waste-resources-or-time,
9920822ded0ac95fa508433e03625974,It would negatively impact individuals because having the Tech-X assistant could be very beneficial and take a lot of stress out of peoples lives. ,stress-overworked,lose-assistance,,
79a88e82e6bf1eb61ba3d09eca191b22,It would slow technological progress,delay-in-innovation,,,
f62be99d5a8b0876be3e80daecef1330,It would increase the workload and time spent on tedious tasks. ,stress-overworked,waste-resources-or-time,,
4e80f7e563d7d561b403e5269da8ec30,it could have the potential to positively change lives by creating helpful opportunities.,no-harm,,,
ffbbe620d41d45714f171a4a2b5041d5,people may not be able to find cure for severe illness as fast,delay-in-innovation,hinder-medical-care,,
5a5deb9f2fab81389f3faae056645106,Not necessarily harmful but we may be left behind by other countries like China which will pose a threat. People will continue to build regardless. ,no-harm,lose-tech-race,,
d840f7993dc6f0bcf50a7b30d3c5a326,Certain already marginalized groups would be left further behind in technological advances. ,impede-personal-growth,lose-accessibility-solution-servie,less-innovation,
3c2c201f2cad0fa1620e19df49b2203b,we will continue with our privately-influenced systems and no additional people will benefit.,no-harm,,,
f4f302f038adb45b396c64d8ec7f84ad,of human errors,human-error,,,
1a65ef57ad154cfc8e4cc097f6520ec5,if it can be developed and it works well and it's profitable it can be bad for the working class if it was never developed,financial-disturbance,business-loss,unemployment,
9d9f0489173d8bf58d7776781064d88b,wouldn't have a way to make things easier disabled people ,lose-accessibility-solution-servie,,,
75f8041d206d78ab3b6da747278ffd04,people would have to use slower services and miss out on potential opportunities,impede-personal-growth,inefficiency,,
389f14d0ca641b86225e1919e8b23be1,"Assuming proper safeguards, not developing this AI would harm plenty of people: disabled people, ordinary workers who would rather be doing something else rather than toiling for a wage, etc.",lose-accessibility-solution-servie,stress-overworked,lose-assistance,
78f006ad883153c135d0966d04314501,"The machine may not be able to learn effectively without some form of confidence, it may be lackluster in its responses and task completion.",inefficiency,human-error,,
464a0aa35c830ab5c60da6074a029128,It would take more time that could be used doing something else ,waste-resources-or-time,,,
b140bdc00402ba4c14545293dff77522,"People could still be exposed to scams and viruses. Scams could get harder to identify, making it difficult for anyone to tell. People incapable of getting human help could struggle with their computer. People might be unsatisfied with their PC build.",inefficiency,stress-overworked,misinformation,lose-assistance
2c116a69bfaf479b89aff49080b27637,it could hamper progress in the world of technology,less-innovation,,,
14da429eb6ae6f245b7e8f1af33de032,It would slow down the advancing of education ,delay-in-innovation,,,
bdd4e8e83678df11b2e01203ff4683d0,It would cause programming to be just as difficult and time consuming as it is now.,inefficiency,waste-resources-or-time,,
a6ba7c0990d982ef0c717583f38aa0af,the tasks is not accomplished and wrong outcome,inefficiency,human-error,,
e4ccf943d031e3cfecf9c0be1663b4ad,"I don't think the lack of developing the app will generate any inherent harm. It can add benefit by being created, but never creating it doesn't directly affect people negatively.",no-harm,,,
c08681761f152d680e9a7925654f6525,"there would be less avenues for help in such situations, because getting help in those things requires social interactions, but that's the very thing you're trying to improve.",impede-personal-growth,lose-assistance,hinder-communication,
0373514cda90fd43543ee029864fb27e,It can’t perform a task that is needed by everyone.,lose-accessibility-solution-servie,,,
f685d70741b327e979e91b9f305cd70e,we would have wasted an opportunity to further explore options that are currently available to us,less-innovation,waste-resources-or-time,,
e49847926cce2fe7467e00977898d0ef,"The doctors will continue to have heavy workloads and they won't be able to do their jobs, as efficiently as it is required. The doctors may increased the risks of being burned out and this could affect the quality of their service.",stress-overworked,hinder-medical-care,mental-harm,
57ebda6f8200952856860a7be93f61bb,"Ethical considerations and responsible deployment are crucial to ensure the positive impact of advancements in scientific research assisted by Tech-X 10. If these considerations were not automated or assisted by Tech-X 10, it would be harmful because it could lead to potential ethical lapses, compromised data integrity, and a higher risk of unintended negative consequences. The absence of these safeguards might result in the misuse of technology, eroding public trust, and hindering the overall positive impact of scientific advancements.",misinformation,human-error,lose-transparency,mental-harm
2d55c8ed04bae785af26592783c04b36,Evidence could be overlooked,human-error,,,
cd5b193e2b9f1b5310af11276bf1fa80,Homeless need easier more accessible help.  My disease makes me very tired and forgetful.  I need help with it to prolong my life. ,lose-accessibility-solution-servie,lose-assistance,health-issues,
fd7d63a93504c572aa29e08a0e5a6d73,"it would slow down research and the advancement of medical technologies. Some people would die waiting for technology, diagnoses and cures to catch up to the discovery of their illness.",delay-in-innovation,less-innovation,physical-harm,hinder-medical-care
287903b59f693633f1d9bf4f90277698,It would make me not make good use of my time because I would have to research and come up with my own grocery list.,inefficiency,waste-resources-or-time,,
6428ac4ecc1c6c05139873314a4c8b52,It would take away a valuable tool that people can use when self teaching or trying to develop new skills.,impede-personal-growth,lose-assistance,,
002f0141fe01f54325883072545d4ebb,the process would be inefficient to the point it fails to constitute meaning.,inefficiency,,,
6fd39d5fe61005e7b92139d80768c5ec,It might cause people to spend more money on similar services that a human worker could provide. It might make things less convenient for them.,inefficiency,financial-disturbance,,
7f57dd83e72171be7e72a03395a08b18,the same of treatment will still be done by trying various way of treatment ,inefficiency,waste-resources-or-time,,
782c7fa6bb672e71054c1913b185221a,some people may rely on such a unit to prepare fresh and nutritious meals that were affordable and available at home. ,lose-accessibility-solution-servie,health-issues,,
5f9fbcb4590624fac976e7e5fb64dfcb,"The application's advanced capabilities could contribute to personal and professional growth by providing insights into savings opportunities, investment strategies, and financial planning. Without it, individuals may miss out on potential avenues for economic advancement.",impede-personal-growth,financial-disturbance,lose-information-knowledge,
7bf1fb876af777da55153e0d417e189b,it would limit creativity and freedom.,hinder-creative-work,,,
408aec8cd9123c0f4e3fa16fbda8f859,it wouldnt necessarily be harmful,no-harm,,,
97e1c674d2c575a4a4e590923465dd0d,We won’t know how to solve these Calculus problems.,impede-personal-growth,lose-information-knowledge,,
12965e1d523b693632399e895474a72c,we  may have a harder time coming up with a solution to polluting the Earth.,environmental-harm-continues,,,
3e3e3e9cbb08a8bdf238bd36cec8a0b9,it would result in less content and less money for me,financial-disturbance,business-loss,,
338ec7076cc4f26e4acd5522a9161132,"it would not, people will still have jobs, robots wont take over the world",no-harm,,,
ff10af1356428ae0930b16bd69eacc77,"Based on history, and the fact that humankind survived just fine without it, I believe there would be no negative impact",no-harm,,,
74a7722ebdd4619831af151dc858f1f4,"The only real negative impact would be that students would find it harder to learn math, and a software engineers job would be more difficult and time consuming.",impede-personal-growth,stress-overworked,waste-resources-or-time,
e62e86fb2c66f2b3dfbca71c5ac1d8dd,it would be more difficult to learn needed things to know for living.,impede-personal-growth,lose-information-knowledge,,
8a5d2d1f40d2de1f14044c7b38f61bf1,People would have to spend lots of time researching a vacation to find hotels and activities they would enjoy,stress-overworked,waste-resources-or-time,,
3c943b599ad77088ac850dbc06e8803d,We would not advance in the area of software programming as quickly as possible.,delay-in-innovation,,,
fb232fe05988561afe58279f6bbb1e7b,It wouldn’t allow data to be analyzed as quickly and would slow down scientific progress towards disease cures ,delay-in-innovation,inefficiency,hinder-medical-care,
8dfb97926b6b7f01d195d78d9d57d715,"Employees may be overworked, leading to poor work/life balance.",stress-overworked,,,
912469ebd49b69578329dd904454aeb4,Our education system is one size fits all and does not work for every individual.,new-code,,,
4d1bc0230a89034c3956db71249c07c0,it could take longer to know if politicans are lying or not.,delay-in-innovation,misinformation,,
4c07febef04fd5d0c4cf9c3f4f83e177,"Less efficient plans, potentials of new builds never fully reached",inefficiency,less-innovation,,
77a9cd53417307bf6c3e513690730fc3,It would take me more time to develop lessons myself,waste-resources-or-time,,,
173d6c4c691bf7706b856eace33f6c8e,You would live a normal life without help from AI,no-harm,,,
a9da1febbc3bcb97d7dc7012e0db07f1,It would lose money,financial-disturbance,,,
9e4f19e2e6f2c7231db2d45db757d334,We would be fine,no-harm,,,
c5b37cc2b9e7afd3b8bd36992703f159,It works not give people opportunities to have freed up work time,stress-overworked,,,
4d6ac74857368d235a6f43ec5f9b1e18,no help would be offered to the busy person who needs suggestions. ,lose-assistance,,,
2786a7ba3781fabee16e5c2095b5e165,some people may not get a thorough recommendation from their doctor. ,hinder-medical-care,,,
a6cc42810af8225db3834b970193861d,there would be no negative impact,no-harm,,,
a636a6f4cde799a77e31fa11052b95d0,I would have to come up with ideas and actions to make my projects on my own.,impede-personal-growth,hinder-creative-work,,
be3c76b02ea3ca205e2a2a22711128aa,We aren’t really progressing as a society by seeking new innovative ways to catch bad guys before they commit crimes and use the crimes they’ve already committed to predict the future. Certain offenders offend again with the same crimes. ,misinformation,human-error,less-innovation,
3a38149269ebe3f0bc99bea65af0f591,"I don’t think it would be harmful, you just wouldn’t have this type of assistance.",no-harm,,,
bcb9f2593721bc603fdbbd50073a5602,It could create more food waste,waste-resources-or-time,,,
c3259392956599cb69c56cf11008ab0d,"The absence of Tech-X 10 could result in slower and less efficient analysis of scientific data, hindering the pace of scientific discovery and delaying potential breakthroughs.",delay-in-innovation,waste-resources-or-time,,
73a53ad8225d472278f3a90795146d80,It would continue to limit this type of validation to slower and less comprehensive methods,delay-in-innovation,inefficiency,,
a65d618d1ff12a35f7e1cb5a9245360c,No harm would be done.  People will just be in the same position they are now having to handle everything.,no-harm,,,
c16e8a2b52da094d23008d2b98e5656e,some people might not get answers they need or find bad answers on the internet that make things worse,misinformation,lose-information-knowledge,,
85e930944101cfe1424c76aef17f62a1,"Could have been creative to pick up some of the AIs thoughts instead of just researching, even if the student didnt take all the information given by Tech.",hinder-creative-work,,,
60c597e9f4fb7b65d344c6f189d24f84,"It really wouldn't be. People would just have to do it themselves, so it would take time.",waste-resources-or-time,,,
2e3a9d97346d18a27b19b6a296e0d0c3,"without the assistance of Tech-x10, I would be stressed out and frustrated. ",stress-overworked,mental-harm,,
2108aeeabb6be93fbf52fcb1401a544f,"the potential for accelerated, effective, and creative problem solving on a global scale would be severely constrained, hindering progress in addressing critical issues.",delay-in-innovation,hinder-creative-work,less-innovation,
be64a10d93d74ee5b4207a517da511d1,we would lose access to a powerful tool.,lose-accessibility-solution-servie,,,
86dc823a1acd400cb58358e49a38f495,If we did not have this then our lives would have not been made easier. ,lose-assistance,,,
652f4bdafe601b7f01aa20ee3aab3a2b,every task would be very slow to do ,inefficiency,waste-resources-or-time,,
d234eea3ad3f2612764a2387e15a8757,new treatment options may not develop and people could die,physical-harm,hinder-medical-care,,
90bb46775d6d850171a5b8b42430a8cc,Company shareholders would be most impacted by not realizing the cost savings of eliminating accounting employees.,economic-distrubance,business-loss,unemployment,
45a08d0a08dcc04e608acfd57ad7c811,it would prevent more and better software,less-innovation,,,
d25d7f72b3f148213c9441670c6f045f,"the greedy CEOs who tried to replace humans wouldn't get their desired outcome. Which is, of course, only negative for them, and a huge net positive for everyone else.",no-harm,business-loss,,
bc3aab74a5807043192f03bb37f76728,People would have to try to figure it out on their own or rely on someone else to do it for them.,inefficiency,lose-assistance,,
c4c1b130e8c2d0da446099c82ff6fd09,It will be harmful as it hurts the will and mood of the nation,mental-harm,,,
08e5ec80411e86b34558fb45ec25b0fa,it would deny people access to information they would be better off with,lose-information-knowledge,,,
50b9f2f7b68fb67912f3fdbaad6a55ae,It would limit resources to knowlede rather than fact of the status of the person's body at any given moment.,lose-accessibility-solution-servie,lose-information-knowledge,,
4ba7f92e249b5423c7b0600877db212b,"It would be harmful to all the big tech companies and other businesses that would use to cut more jobs and pocket the differencce. The average person would not have access to this at any point, so would not be affected negatively.",no-harm,business-loss,unemployment,
cf0ff84c4c8c902fed4312f79452badd,"Because no automated or assisted or number one, we would not know what we were missing. So it's kind of a moot point, but if we're just to kind of brainstorming here, see if it did come up with a. very concrete solution to climate change or even the natural disaster aspect. and we were able to save many lives by using it that way. And then we never automated it where it was banned. Then lives could be lost.",lose-assistance,physical-harm,environmental-harm-continues,
b026a6f3c2454afd9011269e82efdaa9,it might decrease the reach of this assistance to poor or disadvantaged individuals,lose-accessibility-solution-servie,,,
775fc4ef46bfe901520ca2220f12a670,Humans would continue making applications which have vulnerabilities.,human-error,,,
813b00e7390edb62fa6144e0eeed39a7,"companies would no longer be as adaptable and this would make companies less viable or competitive, which could lead to human job loss or harm customers due to less timely identification of product issues. ",inefficiency,lose-assistance,business-loss,unemployment
da687c495c21bfb09dab1d123509102b,If users did not have access to this particular application they would not be able to make better judgments regarding investments. If the application was not developed then the users would have outdated information.,financial-disturbance,lose-information-knowledge,,
016ede1805476bb449b4896e129ae249,"The damages would not be counted in anything, the course of normal life would continue",no-harm,,,
e680b3a6bc63e69156914eeda737b87f,it will become difficult to comprehend calculating complex questions,inefficiency,lose-assistance,,
d8209eed05a7b72f0293300141cac6f9,it might advance scienctific research,na,,,
c823a619b09d8ff77b93705d8ea953e5,It could cause issues where our systems and societies become so complex that we run into a wall in terms of our ability to manage things ourselves or more manually through non-smart systems ,inefficiency,stress-overworked,lose-transparency,
89daafefcd2ab4dfb00694fe1b72e580,People will continue to not receive medical attention they need,hinder-medical-care,,,
dce941be0f502dc139c2ef2791afaf8c,I feel like people with demanding work schedules or with disabilities would be missing out on something that could have a huge impact on their quality of life ,impede-personal-growth,lose-accessibility-solution-servie,lose-assistance,
9146c451934beaa6231caf4263098684,It will make life tough,new-code,,,
a9ef8ecb963364bd7b9f58b912e2e743,It will make my task difficult to perform ,inefficiency,,,
0584811d80b0119249f2b2885bf9baa8,"Could result in slower scientific progress, delayed breakthroughs.",delay-in-innovation,less-innovation,,
24cea6b23501d18238808d061783ee4e,"There are a number of Interlinear Bible translations, so the effect would be minimal. However, most of the interlinear's depend on aged English. A modern translation (while acknowledging that modern doesn't last very long) is quite useful but the harm is minimal.   ",no-harm,,,
09496ad80015802ae2d8d2c4da1b6458,It will make life difficult ,new-code,,,
2e9a89910561e687c74d147f8955b70f,Thousands of people would be left to sleep on the streets and many would die.,unemployment,physical-harm,mental-harm,
5a1723f419c7897061a965269996cd62,"Inefficient and frustrating learning: Traditional methods might not cater to individual learning styles and pace, leading to frustration, disengagement, and ultimately, abandoned language learning journey",impede-personal-growth,inefficiency,stress-overworked,mental-harm
6500b32e2e0051c709b8fddf20103634,We won't be cured if our ailments. ,hinder-medical-care,,,
8de39501262d7562cc5d2a456a250049,some people would lose out on a valuiable resource.,lose-accessibility-solution-servie,,,
909e480e6e6cc5be84b7a6772883e24e,"Not developing technology will be harmful because if it is available and valuable, someone else will develop the technology.",economic-distrubance,lose-tech-race,,
ce09d3badff9e7808cf77cf1d47b4e3a,"it would pass up an opportunity to use new technology to improve healthcare accuracy, efficiency, and customization. This lack of automation may result in delayed diagnoses and treatment, decreased access to specialized knowledge, increased workload on healthcare professionals, limited personalization in treatment plans, increased risk of human error, missed opportunities for innovation, limited scalability of healthcare services, and less efficient use of resources. The capabilities of Tech-X 10 are critical in improving healthcare processes; without them, there is a high danger of detrimental effects on patient care and overall healthcare effectiveness.",stress-overworked,human-error,waste-resources-or-time,hinder-medical-care
e4a0ced935d41130e3788b69211d59ba,The users will suffer as well as those who will be placed in charge of them.,new-code,,,
acdc08e8037f2a8557eb4f2a62f65d9a,"there is a shortage of home care attendants and educators. This could lead to more cases of depression, anxiety and accidents.",lose-assistance,physical-harm,mental-harm,
9d6b7af26a99778deb0a58c4a23ed14d,we can survive without it. ,no-harm,,,
25c8248277437c120f8f1abe62bab220,Important problems may not be resolved fast enough.,delay-in-innovation,,,
6b1b44df09b0c95d52775e0cd92f5eec,it wouldn't be harmful,no-harm,,,
da5798f5fac7da2ca161d7e0e6d01fe7,It would take a lot longer for people to use current research techniques to plow through the data themselves.,delay-in-innovation,waste-resources-or-time,,
08d9c8047b0f324e92053236a83d382d,It would be against mankind to do what is best for people in the name of society.,na,,,
88d76a15b18b8f63bcd5c21e17e1ba6e, individuals might lack access to highly personalized and good retirement strategies,lose-accessibility-solution-servie,financial-disturbance,,
6f627669473d98e6a5799dd7d6c0931b,It could limit our access to a lot of information quickly ,lose-information-knowledge,,,
093711c3e6d5a0bfdea2dcace9901e24,It would not be harmful if it was not autmated,no-harm,,,
b71ce395b1c49b2af3db94484fcff5b8,It could stimulate creativity.  ,no-harm,,,
