ResponseIdHash,Q14_5,code1,code2,code3,code4
c3259392956599cb69c56cf11008ab0d,This kind of failure cases can lead to incorrect hypothesis and data processing errors.,incorrect-ai-output,hinder-science,,
274ccf2d376e944c272e6b6ee493c63d,It would be a waste of time and potentially tarnish the reputation of the platform,waste-resources-or-time,distrust-institution,,
619fe9160723aa29c0967cff62e96c51,It could literally cause someone to lose their case by relying on incorrect cases or briefs,incorrect-ai-output,legal-issues,,
4e80f7e563d7d561b403e5269da8ec30,The negative impact could be injury or death.,physical-harm,,,
cf0ff84c4c8c902fed4312f79452badd,"No, the negative impact of those failure cases being deaf but. injury. people that were maybe without homes, you know, the list could  go on.",physical-harm,range,,
bcb9f2593721bc603fdbbd50073a5602,Poorer health,negative-health-wellbeing,,,
0b87da620e35d054fd39c8a7fad732d1,"It could leave the user feeling disappointed, and unmotivated, and unproductive.",mental-harm,,,
c08681761f152d680e9a7925654f6525,"It would harm social relationships. Not necessarily ending them, but maybe lead to ostracism or loss of trust.",social-isolation,,,
016ede1805476bb449b4896e129ae249,loss and disappearance of people,physical-harm,,,
fe233e2441a6759f22243210fcf7a49e,More people would get sick or die.,physical-harm,negative-health-wellbeing,,
2ce49311b031cfd15806cf7527e32cc5,bankruptcies,financial-disturbance,,,
e680b3a6bc63e69156914eeda737b87f,total misunderstanding,miscommunication,,,
ce09d3badff9e7808cf77cf1d47b4e3a,"Patient harm and worsened health outcomes, Loss of patient trust, Delay in proper medical care, Increased healthcare costs, Diminished adoption of AI in healthcare:",hinder-medical-care,distrust-ai,distrust-institution,
9e93816ec47d887b11ea9e90e2761754,Less confidence in Ai,distrust-ai,,,
ffdd3b62fdaa6c976ada1f608d7a7e67,It would lead to people having the wrong idea and harmful about certain topics and for a group of people. It would also give harmful solutions and answers for the user to try for their question they asked,misinformation,bias,,
7a8c6bfa133a5a484bc1b1126476eada,not test enough before going on market,na,,,
ae7bd2ea37c78ccc8443713792f9622d,The poor healthcare of people leading to perhaps death.,negative-health-wellbeing,hinder-medical-care,physical-harm,
4d1bc0230a89034c3956db71249c07c0,It could make people not vote for someone under false pretenses.,misinformation,manipulate-people,,
fe6afd166efc31adb84800071e7b93d6,"Increased violence, increased bullying, greater polarizations, dismantling of democracies",social-division,physical-harm,,
0b4a08fa2ef9537fa294d82a12d074b5,The policy holder would incur a huge sum of medical expenses.,financial-disturbance,,,
4747f9cebc660a102f1a3dc6b440990f,I see no failure cases,no-harm,,,
50b9f2f7b68fb67912f3fdbaad6a55ae,Death or near death consequences.,physical-harm,,,
6be3a88c2edcbbdd99f432e15ccd3124,then people could be not saying the proper sentences they were trying to,miscommunication,,,
f685d70741b327e979e91b9f305cd70e,people would feel less encourged to attempt this activity again,mental-harm,,,
7abebab1ea76aa1d7464ae24ecbe929b,People wouldn't properly improve and might even learn bad habits.,impede-learning,,,
5d89281741d8f47df529309ef2c2b7b1,"It could continue to be misleading, unacceptable ",misinformation,,,
637afe5f72698b3d974c67d2a4491bb7,A mental breakdown.,mental-harm,,,
1112b3671c909db2bf3a13c2f9d0d4ea,"lowered standards, could cause frustration",lower-quality,mental-harm,,
961edca230872c3041494709cb2828a4,"My diet and health would decline, which might be something that I don't even notice for many years.",negative-health-wellbeing,,,
919e5b2ceb92f3fbfac725def37db6cc,the health of the patient would be compromised,negative-health-wellbeing,hinder-medical-care,,
4a0157be005bcb31b0fc8cedc24a16f4,The reputation of the developers would be ruined,distrust-institution,hinder-career,,
f3ae9e3adb2fcbb94a7a36aeb108c4b3,"It could lead to inconsistences and at the extreme, even loss of life ",incorrect-ai-output,physical-harm,,
f4f302f038adb45b396c64d8ec7f84ad,death,physical-harm,,,
3b07b153bd77735e9660df550a4e3536,"Inaccurate technologies resulting from failures in Tech-X 10 could lead to adverse effects on patient safety, including unexpected side effects, increased risks, or ineffective treatments, potentially causing harm to individuals participating in clinical trials or receiving the treatments.",hinder-medical-care,general-harm,,
50510a2e37fcb1e917b80eac7078be55,It may cost a life or money to repair,physical-harm,financial-disturbance,,
20201c2b66ffd464d8b6adbdfc3836f4,It would lead to injuries and potential legal issues.,physical-harm,legal-issues,,
8e04378591141b2e35ef032cd314657f,Important details could not be communicated or translation issues can cause altercations or other negative circumstances,miscommunication,social-division,,
f7e6fff0e588ea3ccf52708e26c2e761,again the suffering of any survivors,general-harm,,,
a6cf5894b9be0560ac2034be738d6b41,"Embarrassment, ruin of the item, lost of money, lost of time",mental-harm,financial-disturbance,waste-resources-or-time,
900abd7e39b2c8074200a115feee2c6d,The training would be considered inadequate,impede-learning,,,
ae7ed37619ea165e965af00092eecd0e,very minimal,no-harm,,,
a636a6f4cde799a77e31fa11052b95d0,my account being in the hole,financial-disturbance,,,
acdc08e8037f2a8557eb4f2a62f65d9a,"The negative impact could cause disagreements, arguments, wars, dissention and dangerous thoughts besides physical harm.",social-division,physical-harm,,
6c3859497408f69338c4bf67bf36186d,"If tech x created a website that was glitchy, prone to crashes or other serious issues, it could have a negative impact on business.  A poor website causes a bad experience for customers and this could lead them to seek out other options.",financial-disturbance,distrust-institution,,
a7fc499ed69ded16e23e00c2a36f9a9c,Lost of foods which would be extra cost to bear by the restaurant,financial-disturbance,,,
72d216b8c94c89767a52f72ef140705f,less sales and business collapse,financial-disturbance,,,
4ba7f92e249b5423c7b0600877db212b,It could lead to unforseen expenses that coupdnt easily be paid. Major medical crisis that can't be treated in a timely or effective manner.,hinder-medical-care,financial-disturbance,,
12ae19854da7ef4137be69d5f60aefa9,A greeat consequence on the valuation of the company,financial-disturbance,,,
78f006ad883153c135d0966d04314501,"The belief, use and propagation of wrong information.",misinformation,,,
9920822ded0ac95fa508433e03625974,Whatever you asked Tech-X 10 to invest would be gone and depending on how much the user decided to give it access to it could be bad. There would obviously need to be safeguards,financial-disturbance,,,
8dfb97926b6b7f01d195d78d9d57d715,Decrease engagement - loss of profits,financial-disturbance,,,
8dfa5ce2ebca1f5d287311dde04dce1b,I think providing incorrect information could generally just make people's lives harder.,general-harm,incorrect-ai-output,,
e79299a8b60775bbab62b06615651ed6,"It could potentially kill someone and even if it wasn't the extreme case, people might not trust it and not want to use it.",physical-harm,distrust-ai,,
5a5deb9f2fab81389f3faae056645106,Car accidents in vehicles. Fires or explosions in buildings and houses.,physical-harm,,,
32402c6238774f7c806e3cb21c0e573d,It would completely siruot my finances. Not let me have credit when i possibly really need it.,financial-disturbance,,,
97e1c674d2c575a4a4e590923465dd0d,so they end up getting bad homework grades.,lower-quality,hinder-career,,
39d4042f86a82d1c25d97af923aa3a75,They could range from a minor inconvenience to death depending on how sensitive or urgent the situation was.,range,physical-harm,general-harm,
c9e7827fbe7e042a1f05fa5c13856285,Identifying the victims,na,,,
be64a10d93d74ee5b4207a517da511d1,It could result in faulty or injurious products/designs.,lower-quality,incorrect-ai-output,physical-harm,
e49847926cce2fe7467e00977898d0ef,The negative impact would be loss of business and decreased trust in the medical professionals. It can also ruin reputations and there could possibly be legal charges.,distrust-institution,economic-disturbance,legal-issues,hinder-career
b71cd0421551664a42a80a5356202ddb,Anyone who chose to allow the AI to perform medical procedures/surgeries.,na,,,
a6cc42810af8225db3834b970193861d,there wouldn't be any,no-harm,,,
0b50b885d43e1fe54a3be3c5c3858481,"Misunderstandings and misinterpretations, even from a robotic device can give a person mental stress and confusion.",miscommunication,,,
a64ddcf323c53bfc242426f09458455f,death of the individual,physical-harm,,,
fc0058c0a20ef161a56ae92727889f57,It would make the stories bad,lower-quality,,,
a3d4ba394e62883ccb20397ade3a8ccb,"Would cause alot of distress, panic, overwhelment and so on.",mental-harm,,,
b9f8bd55cefcd56c366a1ae177bd6875,"People would be experiencing low quality consulting services, which include things like outdated information or misinformation ",lower-quality,misinformation,incorrect-ai-output,
24cea6b23501d18238808d061783ee4e,That a false doctrine would appear as fact.,misinformation,,,
652f4bdafe601b7f01aa20ee3aab3a2b,failed work.,na,waste-resources-or-time,,
9ff9b390943cc8629f962d25e2256f01,It could kill the hostages or victims instead of apprehending the suspects.,physical-harm,,,
6428ac4ecc1c6c05139873314a4c8b52,technological progress is stilted,hinder-science,,,
c823a619b09d8ff77b93705d8ea953e5,Could cause anything from minor issues to loss of life,range,physical-harm,general-harm,
89daafefcd2ab4dfb00694fe1b72e580,Making people more sick than they already are or even death,negative-health-wellbeing,physical-harm,,
6fd39d5fe61005e7b92139d80768c5ec,"It depends on what people would use it for - I can see how it could potentially cause a lot of harm. Someone might lose their savings, stocks, or retirement money. Someone could be given the wrong medical advice if they used it for that, and the consequences could be deadly.",general-harm,overreliance,financial-disturbance,hinder-medical-care
2d55c8ed04bae785af26592783c04b36,"False imprisonment, missing people dying in the process of waiting, wasting police time",waste-resources-or-time,physical-harm,,
85e930944101cfe1424c76aef17f62a1,A bad grade for student,lower-quality,hinder-career,,
dce941be0f502dc139c2ef2791afaf8c,People could find themselves delinquent in bills for things like electricity or Internet and other services,financial-disturbance,legal-issues,,
2786a7ba3781fabee16e5c2095b5e165,People not getting better or getting sicker.,negative-health-wellbeing,,,
68ae9acdd93d6b3d1ee0a758cdde777b,the same as negativity not using the tech any longer,distrust-ai,,,
87b666f0d46fac7dba96d8f3afb2e320,lawsuits,legal-issues,,,
